p_680,20.0,Male,White or Caucasian,English,"Some high school, no diploma",0.0,self_concept_1,self_concept,Cognitive Dissonance Theory,23.94,3,0.0,2,0.0,2,0.0,4,4,False,0,False,1,1.47,1,3.86,0.0,0.0,6.67,1.75,6.4,3.67,5.67,5.2,3.67,5.5,4.5,5.5,6.5,4.0,6.5,5.0,5.83,5.0,5.5,6.5,4.5,5.38,3.5,5.0,6.0,5.5,5.0,1.0,4.67,i dont remember,1.0,just something hard,it made me think of something related to the text,not sure,not sure,"i thought it would be better to not drag but to type, easier as well. I found it hard but its a challenge"
p_681,33.0,Female,White or Caucasian,Hungarian,Bachelor’s degree,1000.0,descriptive_norms_2,descriptive_norms,Social Norms Theory,17.57,2,0.0,2,0.33,6,1.0,12,16,False,0,True,0,0.0,1,23.02,0.0,0.0,7.0,5.0,6.6,1.67,4.33,4.4,4.33,6.5,2.0,4.5,4.5,2.5,1.0,4.5,2.5,4.5,1.0,4.5,4.0,3.5,2.5,1.0,1.0,3.0,1.88,1.22,4.5,"Community, how people behave and maybe how I should behave",3.0,Confusion,Tried to find behavioural words,no,don't know,
p_682,26.0,Male,ARAB,Arabic,Master’s degree,20.0,performance_accomplishments_3,performance_accomplishments,Self-Efficacy Theory,44.15,6,0.0,3,0.0,4,0.0,6,6,False,0,False,1,4.46,0,0.0,0.0,0.0,6.0,5.62,5.2,3.33,3.0,3.0,3.33,6.0,4.0,4.5,6.0,5.0,4.0,5.17,4.67,4.0,3.0,4.0,4.0,3.75,4.0,3.5,4.0,3.5,3.75,2.44,4.17,Did you experience a sense of mastery?,2.0,Struggled,Motivated,No,Encouragement,it was stimulating and well-framed by the motivational message. The message helped set a positive tone and encouraged effort. The survey questions were clear and encouraged reflection
p_683,34.0,Female,Black or African American,English,Master’s degree,7.0,verbal_persuasion_1,verbal_persuasion,Self-Efficacy Theory,14.04,8,1.0,1,1.0,1,1.0,0,0,False,0,True,1,50.16,1,102.03,0.0,0.0,6.0,5.38,6.2,4.67,4.0,5.8,4.67,5.5,6.0,5.0,4.0,4.5,3.0,5.0,4.33,5.5,5.0,5.0,5.0,5.12,4.5,4.5,4.5,5.0,4.62,2.33,3.67,no,1.0,I neede to be focus on the event,concentration level,no,nill,nill
p_685,34.0,Male,White or Caucasian,english,Master’s degree,100.0,verbal_persuasion_2,verbal_persuasion,Self-Efficacy Theory,25.71,4,0.0,2,0.0,3,0.0,6,6,False,0,False,0,0.0,1,165.23,0.0,0.0,6.0,3.62,4.8,1.0,1.0,3.0,2.0,5.0,5.0,5.0,5.0,5.0,5.0,5.0,5.0,2.0,2.0,2.0,2.0,2.0,2.0,3.5,2.0,2.0,2.38,2.78,2.17,The message didn't open. It is not clickable,1.0,The message didn't open for me,none,none,no,none
p_686,36.0,Male,White or Caucasian,english,Bachelor’s degree,100.0,dissonance_reduction_3,dissonance_reduction,Cognitive Dissonance Theory,16.88,8,0.0,3,0.0,7,0.0,22,22,False,0,False,0,0.0,0,0.0,1.0,0.0,6.33,6.88,6.8,7.0,4.67,7.0,5.67,7.0,1.0,7.0,1.0,2.0,3.5,5.33,1.83,7.0,6.5,7.0,4.0,6.12,5.0,3.5,1.0,1.0,2.62,1.67,3.17,changing words slightly to make more,4.0,reminder of how i can quickly add more words,i started to use past tense versions too,make small tweaks,one small change can make lots of other words,"fun, moving letters with mouse does take up more time though."
p_687,23.0,Female,White or Caucasian,English,Bachelor’s degree,4.0,dissonance_reduction_2,dissonance_reduction,Cognitive Dissonance Theory,24.96,4,0.0,4,0.0,8,0.0,26,26,False,0,False,0,0.0,0,0.0,2.0,0.0,6.33,4.25,5.6,6.33,2.67,3.4,6.33,4.5,4.0,5.0,3.0,3.0,3.5,4.17,3.5,4.0,1.5,2.5,4.0,3.0,5.5,4.0,1.5,1.0,3.0,2.11,3.83,Why was i not able to do well in the challenge? What was holding me back?,4.0,Indifference,No,No,"Not sure, maybe emphasise what was holding me back?",
p_688,29.0,Male,White or Caucasian,English,Master’s degree,20.0,dissonance_reduction_2,dissonance_reduction,Cognitive Dissonance Theory,15.29,8,0.0,5,1.0,8,1.0,0,26,False,0,True,0,0.0,1,1.26,0.0,0.0,6.0,5.38,5.8,2.67,2.0,2.6,3.0,5.5,2.5,5.5,2.0,3.0,4.0,4.67,2.83,6.0,2.0,4.0,5.0,4.25,3.0,4.5,2.0,2.0,2.88,2.22,4.33,that you should think about what you stand for as a person.,2.0,Confusion as to why such a message was being displayed before a word puzzle,It did not influence me at all,"No, other than that it was strange","I would change the content of the message completely and give some actual advice on how to do better at the puzzle; e.g. if you can't think of a word, put letters on the board to make it easier to think of what the rest of the word could be",
p_689,25.0,Female,White or Caucasian,English,Bachelor’s degree,1.0,injunctive_norms_3,injunctive_norms,Social Norms Theory,20.88,2,0.0,1,0.0,6,0.0,22,22,False,0,False,0,0.0,0,0.0,1.0,0.0,7.0,6.5,4.8,3.67,5.0,5.4,4.33,7.0,1.0,4.5,3.0,4.0,1.0,5.17,1.67,2.5,1.0,1.0,1.0,1.38,4.0,4.0,4.0,6.0,4.5,1.44,5.67,"to complete work of a high-standard, you must adhere to your non-negotiables",3.0,"Surprise, because I don't associate hardcore 'non-negotiable' values with casual scrabble style games.","It made me concentrate extra hard because I identify as a high-performer, in all aspects of life.",None- I was concentrating too hard on forming words.,I would emphasise staying calm and thinking about adding prefixes and suffixes to words.,The word creation task was challenging but fun and reminded me of NYT Spelling Bee. The message was vague and somewhat irrelevant. Quality of instructions and interface great :)
p_690,25.0,Female,Asian / Pacific Islander,"English, Kannada, Malayalam, Hindi, Tamil, Telugu",Bachelor’s degree,3.0,vicarious_experience_1,vicarious_experience,Self-Efficacy Theory,15.98,2,1.0,1,1.0,4,1.0,0,20,False,0,True,0,0.0,1,47.12,0.0,2.0,6.0,4.12,7.0,5.0,3.0,7.0,5.67,4.5,3.5,5.0,3.0,5.0,1.5,4.83,2.67,5.0,6.5,5.5,5.5,5.62,5.0,3.0,4.0,3.5,3.88,1.22,5.33,how to carry the word creation challenge forward,2.0,that i need to hurry and make more words,nope,to make as many words as possible,to stay calm and start of with small words and then move on to larger words,
p_691,31.0,Female,White or Caucasian,English,Master’s degree,5.0,self_concept_2,self_concept,Cognitive Dissonance Theory,12.21,4,0.0,2,1.0,10,1.0,0,48,False,0,True,0,0.0,1,7.19,4.0,1.0,5.33,5.88,5.4,4.0,3.0,4.4,4.67,5.5,4.0,4.5,3.0,4.0,3.0,4.67,3.33,5.0,4.0,4.5,3.5,4.25,5.0,5.0,4.0,4.5,4.62,1.44,4.0,trusting my instrict,2.0,I appreciated the support,it didn't,no,I'd encourage them to think of variants of the word you've found - a more practical message,"enjoyed it, the survey felt quite long"
p_692,29.0,Female,White or Caucasian,english,Trade/technical/vocational training,50.0,social_sanctions_2,social_sanctions,Social Norms Theory,13.24,4,0.0,1,0.0,3,0.0,6,6,False,0,False,0,0.0,1,15.72,0.0,0.0,6.67,4.62,4.2,4.0,4.0,4.0,4.67,4.0,5.0,2.0,5.5,4.0,3.5,3.33,4.67,4.0,4.0,4.0,4.0,4.0,4.0,4.0,4.0,4.0,4.0,3.33,4.33,motivation to do well in the task & potential feedback,2.0,I felt confused for a second as I was unsure if I needed to respond,I think it made me consider feedback which at that time I thought will probably be need to improve,Not that I can think of,I would add maybe some motivational element such as believe in yourself to see if this could help with performance,
p_693,33.0,Female,White or Caucasian,English,Master’s degree,5.0,vicarious_experience_2,vicarious_experience,Self-Efficacy Theory,13.16,4,1.0,3,0.0,7,0.0,20,20,False,0,False,0,0.0,1,0.39,1.0,0.0,7.0,6.0,5.6,6.0,2.0,4.0,5.33,6.5,2.0,4.5,4.0,4.0,2.0,5.0,2.67,4.5,2.5,3.0,2.5,3.12,5.5,5.0,2.5,3.0,4.0,2.33,3.67,If I kept practicing I would get better.,3.0,Thought it was stating the obvious.,It didn't.,No.,"I would probably just do the same message, or state the average improvement of players.",Being able to type the letters would be nice.
p_694,34.0,Male,White or Caucasian,Enlgish,Master’s degree,20.0,control,control,No Theory,12.36,5,0.0,4,0.0,7,0.0,22,22,False,0,False,0,0.0,0,0.0,0.0,0.0,4.33,5.25,5.0,6.67,2.67,4.0,5.33,5.0,5.0,3.5,3.5,3.5,4.0,4.0,4.17,3.5,3.5,3.5,4.0,3.62,4.5,3.5,5.0,4.0,4.25,2.89,3.33,Press the button when the select button appears to proceed,4.0,None - simple message instructing the next step,It detailed what to expect in order to proceed,No. it was just to select the button to continue,"Nothing to add, it was a simple message.",
p_695,32.0,Female,mixed,English,Bachelor’s degree,0.0,relatedness_1,relatedness,Self-Determination Theory,18.27,4,0.0,4,0.0,8,0.0,16,16,False,0,False,0,0.0,0,0.0,0.0,0.0,7.0,5.5,5.6,3.33,1.0,2.8,5.67,5.0,4.5,4.5,4.5,5.5,2.0,5.0,3.67,4.5,1.0,1.5,2.5,2.38,3.5,2.5,2.5,1.0,2.38,1.56,4.67,Remember how you affect others in the world,3.0,Wondered why this was important,"It didn't, once the challenge started I focused on the task",No,It was about how you affect other people around you,
p_696,25.0,Female,Black or African American,"English, Igbo",Bachelor’s degree,1.0,competence_1,competence,Self-Determination Theory,19.86,4,1.0,2,1.0,7,1.0,0,14,False,0,True,1,47.88,0,0.0,1.0,0.0,6.33,2.25,7.0,7.0,6.33,6.8,7.0,5.5,4.0,5.5,2.5,4.5,3.0,5.17,3.17,5.5,6.0,6.0,5.5,5.75,5.0,6.0,6.0,5.5,5.62,1.67,5.5,Really tapping into thinking and trying your best.,3.0,I felt supported and more motivated,It made me want to create as many words as possible.,no,"Don't overthink it and try as best as you can. Think of it as a fun, creative experience.",Unsure
p_697,23.0,Female,Black or African American,English,Bachelor’s degree,10.0,reference_group_identification_2,reference_group_identification,Social Norms Theory,21.25,4,0.0,4,1.0,10,1.0,0,40,False,0,True,1,10.6,0,0.0,1.0,1.0,6.0,3.88,5.6,3.0,2.0,3.2,4.0,5.5,6.0,4.5,4.0,2.0,3.5,4.0,4.5,3.5,3.0,2.5,2.5,2.88,3.5,4.0,2.0,2.0,2.88,2.0,3.17,being true to yourself and working in a team.,1.0,I am not sure.,I didn't feel it was relevant to the task. Quite a random message.,No.,I am not sure.,
p_698,27.0,Female,Black or African American,English,Bachelor’s degree,80.0,autonomy_3,autonomy,Self-Determination Theory,17.01,3,0.0,2,0.0,4,0.0,12,12,False,0,False,0,0.0,1,0.83,0.0,0.0,7.0,7.0,7.0,4.33,7.0,7.0,6.67,3.5,6.0,6.5,1.5,4.5,1.0,4.83,2.83,6.5,7.0,7.0,6.0,6.62,7.0,6.5,6.0,7.0,6.62,1.0,2.5,"I do not remember, I was fixated on doing the words play.",2.0,How fast I need to think of new words,Speed and accuracy of coming up with words,I needed to complete as many words as possible with the allocated time,Time that is given and the minimum number of letters for a valid word,How people concentrate on a task that has an instant reward.
p_699,23.0,Male,White or Caucasian,English,Master’s degree,10.0,competence_3,competence,Self-Determination Theory,11.6,6,0.0,5,0.0,7,0.0,10,10,False,0,False,0,0.0,0,0.0,0.0,0.0,7.0,5.5,6.0,6.0,2.0,2.6,5.0,5.5,3.0,6.0,3.0,4.0,2.5,5.17,2.83,6.0,6.0,6.0,4.5,5.62,6.0,4.5,4.5,6.0,5.25,2.44,6.17,the instructions for the task,2.0,Nothing specific,,,More motivation,
p_700,36.0,Female,White or Caucasian,English,Bachelor’s degree,10.0,reference_group_identification_3,reference_group_identification,Social Norms Theory,14.52,6,0.0,1,1.0,4,0.5,0,20,True,2,True,0,0.0,1,26.96,0.0,1.0,6.67,6.12,6.6,4.0,3.0,3.6,4.67,6.0,4.0,4.5,5.0,4.0,3.0,4.83,4.0,4.0,3.0,3.0,3.0,3.25,4.5,6.0,4.5,5.0,5.0,1.33,5.67,something about life. But I really can't remember!,1.0,heartfelt and good,it didn't,no,"I didn't find the message helped with the challenge at all, and I'm not sure if any message would. Personally, I would have preferred to just get on with the challenge.",I enjoyed it. It was more difficult than I thought it would be but I enjoyed taking part
p_701,21.0,Female,Black or African American,English,"High school graduate, diploma or the equivalent (for example: GED)",100.0,competence_2,competence,Self-Determination Theory,15.11,6,0.0,2,0.0,7,0.0,20,20,False,0,False,0,0.0,0,0.0,1.0,0.0,7.0,3.88,6.8,7.0,1.33,2.4,6.33,4.5,5.0,6.0,3.5,5.0,3.0,5.17,3.83,5.5,2.0,2.0,4.5,3.5,4.5,6.0,4.5,3.5,4.62,1.33,5.83,how word creation can be frustrating and challenging at first,1.0,"happy, encouraged",it didnt as i was too focused on the task,no,i would emphasise that they should ignore the time limit and to go slow and steady,
p_702,32.0,Male,White or Caucasian,English,Bachelor’s degree,1.0,injunctive_norms_1,injunctive_norms,Social Norms Theory,14.26,4,0.0,3,0.0,5,0.0,10,10,False,0,False,0,0.0,0,0.0,0.0,0.0,6.33,6.25,6.8,3.0,6.0,4.0,5.67,6.0,3.0,4.0,3.5,5.5,5.0,5.17,3.83,4.5,3.0,4.0,3.5,3.75,6.0,6.0,4.5,6.0,5.62,1.11,3.0,Being in other peoples shoes and what would you do and choose,2.0,"charity, thinking of others less fortunate",no I wouldn't say it had much affect on how I approached the challenge,"no, I was too focused on the challenge",I would include thinking creatively,
p_703,20.0,Male,Asian / Pacific Islander,English,College Degree (UK),40.0,competence_3,competence,Self-Determination Theory,11.78,1,0.75,4,1.0,14,0.0,0,46,True,14,True,1,12.6,1,1.4,1.0,1.0,6.33,5.25,6.4,5.33,5.0,6.0,5.67,5.0,3.5,5.5,2.5,4.0,2.0,4.83,2.67,3.5,5.0,5.0,5.0,4.62,4.0,5.0,5.0,5.5,4.88,2.11,5.17,I struggled but I kept trying and trying,2.0,Glad?,I took my time with it and got a lot more than I thought I would,To try again and again,Emphasize to keep trying and dont give up,
p_704,24.0,Male,Asian / Pacific Islander,english,Bachelor’s degree,15.0,descriptive_norms_2,descriptive_norms,Social Norms Theory,13.87,7,0.0,1,0.0,3,0.0,8,8,False,0,False,0,0.0,1,2.75,0.0,0.0,7.0,5.38,6.2,2.67,2.0,2.2,5.33,4.5,5.0,2.5,5.0,4.0,2.5,3.67,4.17,4.0,3.5,3.5,5.5,4.12,5.5,5.5,4.0,4.5,4.88,2.0,2.17,being one with the world,2.0,i was content,it did not have an influence for me,no aspect stayed with me,to clear the mind and be ready for the puzzle,it was competent and i enjoyed the experience
p_705,35.0,Male,White or Caucasian,English,"Some college credit, no degree",500.0,injunctive_norms_1,injunctive_norms,Social Norms Theory,23.87,6,0.0,0,0.2,5,1.0,8,12,False,0,True,0,0.0,1,5.47,0.0,0.0,7.0,6.5,7.0,5.0,4.67,7.0,6.0,5.5,3.0,5.0,3.5,5.0,2.5,5.17,3.0,5.5,5.0,4.5,5.0,5.0,4.5,5.5,5.5,6.0,5.38,1.67,2.0,"What other people would do in my shoes, are behaviours acceptable or unacceptable",4.0,"I was relaxed and calm, my emotions were happy",All i considered was how others would complete the challenge,"Nothing stayed with me, just thinking about how others would be completing it",I would emphasise on telling people to stay focused,"Was a great, fun study. Thank you"
p_706,25.0,Female,White or Caucasian,English,Professional degree,15.0,self_concept_2,self_concept,Cognitive Dissonance Theory,18.41,3,0.0,2,0.57,7,1.0,10,28,False,0,True,0,0.0,1,12.33,1.0,0.0,5.67,4.5,6.0,3.67,3.33,4.0,3.33,5.5,5.5,3.0,4.5,3.0,4.5,3.83,4.83,2.0,2.0,6.0,5.5,3.88,4.5,3.5,1.5,2.0,2.88,1.56,2.5,something about solving it in a unique way and trusting your inner guide,4.0,confusion,It made me think about it a bit more,solving it in a unique way,tell people to stay calm,It was fun
p_707,25.0,Female,Black or African American,english,Bachelor’s degree,20.0,descriptive_norms_1,descriptive_norms,Social Norms Theory,13.96,6,0.0,1,0.0,5,0.0,6,6,False,0,False,0,0.0,0,0.0,0.0,0.0,7.0,5.0,6.4,3.0,2.0,4.0,2.0,5.5,4.0,5.5,5.0,4.0,2.0,5.0,3.67,4.0,2.0,2.0,2.0,2.5,6.0,5.5,5.0,5.0,5.38,1.11,5.5,trying something new and drawing on other people's experience,3.0,confused,it didnt,no,try your best and be creative,
p_709,28.0,Male,White or Caucasian,English,Bachelor’s degree,3.0,dissonance_reduction_2,dissonance_reduction,Cognitive Dissonance Theory,125.07,3,1.0,3,0.67,3,1.0,4,8,False,0,True,0,0.0,1,41.0,0.0,0.0,7.0,5.0,6.6,3.0,2.33,3.4,4.0,7.0,1.5,3.0,3.0,3.5,3.0,4.5,2.5,2.5,3.0,5.0,5.0,3.88,6.5,4.5,3.5,4.0,4.62,1.11,5.0,Something stopping me from pursuing something,2.0,Confusion,,No,Something more understandable,
p_710,27.0,Female,White or Caucasian,English,"Some college credit, no degree",10.0,self_concept_2,self_concept,Cognitive Dissonance Theory,16.03,6,0.67,3,0.0,9,0.0,24,24,False,0,False,1,2.9,0,0.0,1.0,0.0,7.0,4.75,6.6,1.33,1.0,3.6,2.67,7.0,3.0,6.0,1.0,6.0,1.5,6.33,1.83,7.0,7.0,7.0,7.0,7.0,6.5,6.0,6.5,5.5,6.12,1.0,5.0,I have completely forgot the sentence when I went onto to do the second part of the challenge,1.0,I can't remember it sorry so I can't comment on this,I can't remember it sorry so I can't comment on this,I can't remember it sorry so I can't comment on this,I can't remember it sorry so I can't comment on this,
p_712,23.0,Female,White or Caucasian,"Welsh, English",Bachelor’s degree,0.0,performance_accomplishments_1,performance_accomplishments,Self-Efficacy Theory,12.32,6,0.0,6,0.0,10,0.0,30,30,False,0,False,0,0.0,0,0.0,1.0,0.0,4.33,3.62,7.0,3.67,1.0,1.0,2.67,6.5,2.5,5.5,1.5,3.0,3.0,5.0,2.33,1.0,1.0,1.0,1.0,1.0,1.0,1.0,1.0,1.0,1.0,1.0,3.67,"That we are very capable and we should do our best, like a motavational message",4.0,Nothing,no,no,I do not see the point of the message,
p_713,29.0,Male,White or Caucasian,English,Bachelor’s degree,0.0,cognitive_inconsistency_2,cognitive_inconsistency,Cognitive Dissonance Theory,16.42,6,0.0,1,0.33,3,1.0,6,8,False,0,True,0,0.0,1,41.04,0.0,0.0,7.0,5.12,5.4,5.67,5.33,4.8,4.67,5.0,2.5,5.0,2.5,3.0,3.5,4.33,2.83,4.5,4.5,5.5,5.0,4.88,5.5,6.0,4.5,5.0,5.25,2.0,4.5,The message referred to the contradictory feelings between wanting to just get something done and thinking longer about it.,4.0,Nothing.,It made me think of how long to spend on each question.,Nothing.,I would emphasize not spending to much time on each task.,
p_714,28.0,Male,White or Caucasian,English,Bachelor’s degree,2000.0,self_concept_3,self_concept,Cognitive Dissonance Theory,15.63,4,1.0,3,1.0,9,1.0,0,30,False,0,True,0,0.0,1,15.84,2.0,0.0,7.0,5.88,6.2,4.0,1.0,4.0,4.0,4.0,3.5,4.0,3.0,3.5,4.0,3.83,3.5,4.0,3.0,3.5,4.5,3.75,4.0,4.0,4.5,4.0,4.12,1.33,4.0,sorry I honestly can't remember,1.0,Sorry can't remember the message,none,no,making people feel good about themselves before the puzzle,All good
p_715,26.0,Male,Asian / Pacific Islander,English,Bachelor’s degree,40.0,vicarious_experience_1,vicarious_experience,Self-Efficacy Theory,28.19,2,0.0,5,0.0,4,0.0,12,12,False,0,False,0,0.0,1,1.68,1.0,0.0,6.0,5.62,5.0,4.67,3.67,4.4,6.0,5.5,3.5,3.5,4.0,5.0,3.5,4.67,3.67,3.0,3.5,3.5,3.5,3.38,5.0,5.0,4.0,5.0,4.75,2.44,5.17,The message was about adversity and resilience. Seeing someone overcome challenges gives you a confidence booster.,4.0,Resilience is needed when overcoming challenges are the thoughts I had,Keep thinking of new words even when I wanted to give up,The message of resilience and adversity was a good touch,Emphasize on the resilience part rather than saying imagine someone you knew overcame a challenge,
p_716,35.0,Male,White or Caucasian,English,Trade/technical/vocational training,0.0,self_concept_3,self_concept,Cognitive Dissonance Theory,23.73,4,0.0,1,0.2,5,1.0,12,12,False,0,True,0,0.0,1,3.1,0.0,0.0,6.33,4.62,7.0,3.33,2.0,2.6,3.33,5.5,2.0,5.0,4.0,4.0,2.0,4.83,2.67,3.5,2.5,2.5,2.0,2.62,4.0,2.5,2.0,2.0,2.62,1.33,3.0,putting effort in to your work to achieve what you want.,2.0,Enthusiasm,It did not influence how I approached the challenge,No,Emphasize calmness and belief,Enjoyed the challenge.
p_718,27.0,Female,White or Caucasian,English,Master’s degree,300.0,self_concept_1,self_concept,Cognitive Dissonance Theory,12.82,7,0.0,5,0.0,11,0.0,42,42,False,0,False,0,0.0,0,0.0,2.0,0.0,5.67,5.88,6.4,3.67,2.0,4.4,3.33,5.0,2.5,5.5,1.0,4.0,3.0,4.83,2.17,4.0,2.0,2.0,2.0,2.5,3.0,4.0,2.0,2.0,2.75,1.33,4.67,"about my sense of self, my creative nature.",4.0,"I felt relatively neutral, the text felt a bit corporatey in terms of its encouragement.",It didn't change how I approached the task.,"No, my mind was focused purely on the letters.","I would give people tactics on finding anagrams and ways to up the letters (e.g., adding ed to the end of shorter words to get an extra, past tense word)",
p_719,,,,,,,control,control,No Theory,20.72,7,0.25,4,1.0,8,0.75,0,38,True,2,True,1,1.88,1,6.44,2.0,1.0,,,,,,,,,,,,,,,,,,,,,,,,,,,,,,,,,,
p_720,35.0,Female,White or Caucasian,english,Bachelor’s degree,30.0,cognitive_inconsistency_1,cognitive_inconsistency,Cognitive Dissonance Theory,13.09,2,0.0,3,1.0,2,1.0,0,6,False,0,True,0,0.0,1,32.91,1.0,0.0,5.67,3.62,5.6,4.0,2.0,2.0,4.0,6.0,2.5,1.5,5.5,3.5,2.5,3.67,3.5,3.5,4.0,4.0,4.0,3.88,4.0,4.0,4.0,4.0,4.0,2.44,3.33,I can't remember,1.0,i cant remember the message,no,no,i dont know,
p_721,35.0,Female,White or Caucasian,English,Bachelor’s degree,50.0,injunctive_norms_3,injunctive_norms,Social Norms Theory,12.88,7,0.0,4,0.0,9,0.0,30,30,False,0,False,0,0.0,0,0.0,1.0,0.0,7.0,5.88,7.0,3.33,2.0,2.0,4.0,6.0,3.0,5.5,2.0,5.0,2.0,5.5,2.33,4.0,3.5,4.0,4.0,3.88,4.0,4.0,4.0,4.0,4.0,3.0,3.83,something about taking this seriously and respecting the research. Sorry I didn't realise I had to memorise it!,1.0,I remember thinking it was a bit out of place,"It didn't at all, I was just keen to get cracking on with the challenge",no,I wouldn't include it,"I was surprised about how the message before the game became the MAIN focal point, I thought the message was a bit out of place as well so I didn't pay too much attention to it. It felt a bit pushy somehow. Hopefully my feedback to that is all part of the point of this study I guess! I really enjoyed doing the word challenge too. Best of luck with all your research"
p_722,28.0,Female,Asian / Pacific Islander,Indonesian,Master’s degree,2.0,cognitive_inconsistency_2,cognitive_inconsistency,Cognitive Dissonance Theory,12.2,6,0.4,5,0.0,4,0.0,10,10,False,0,False,1,3.23,1,0.41,0.0,0.0,5.33,5.5,5.2,4.0,4.0,5.6,5.33,4.0,6.0,4.0,6.0,4.0,3.5,4.0,5.17,5.0,5.0,5.0,5.0,5.0,5.0,5.5,5.0,6.0,5.38,2.44,4.83,the instruction of the puzzle,2.0,I felt assured getting to know the instruction,It drives me to think words as quickly as the time is short,Higher reward with more letter to form words,Time limit,
p_723,23.0,Female,Black or African American,english,"Some college credit, no degree",6.0,dissonance_arousal_1,dissonance_arousal,Cognitive Dissonance Theory,13.37,4,0.0,3,0.0,7,0.0,18,18,False,0,False,0,0.0,0,0.0,0.0,0.0,6.67,6.12,6.0,3.0,2.0,2.0,3.67,6.0,4.0,4.5,4.0,4.5,3.0,5.0,3.67,3.5,3.0,3.0,3.0,3.12,3.5,3.5,2.0,2.0,2.75,1.22,3.67,trying your best,1.0,not sure,not sure,"honestly, i forgot about it almost immediately",to try their best and not be discouraged,
p_724,24.0,Male,Black or African American,ENGLISH,Bachelor’s degree,5.0,relatedness_3,relatedness,Self-Determination Theory,14.51,10,0.0,0,0.0,4,0.0,14,14,False,0,False,0,0.0,1,4.53,0.0,0.0,7.0,7.0,7.0,7.0,7.0,7.0,7.0,7.0,1.0,7.0,4.0,7.0,1.0,7.0,2.0,7.0,7.0,7.0,7.0,7.0,7.0,7.0,7.0,7.0,7.0,1.0,3.5,that I should think of my surrounding and all that close to me will make the word creation easy,5.0,how to form the words making use of what am surrounded with,yes,I quickly think what words I can create looking at my environment,they should focus on what surround them will help to form a word faster,nice study
p_725,27.0,Male,White or Caucasian,English,"High school graduate, diploma or the equivalent (for example: GED)",3.0,self_concept_2,self_concept,Cognitive Dissonance Theory,14.64,6,0.0,5,0.14,7,1.0,12,16,False,0,True,0,0.0,1,5.29,0.0,0.0,6.0,4.75,5.6,2.67,2.67,3.2,2.33,6.0,2.5,5.5,3.0,3.5,2.5,5.0,2.67,5.5,3.0,5.0,6.0,4.88,4.0,5.0,2.5,2.5,3.5,2.0,5.5,Looking within for a creative spark,1.0,Boredom as it felt AI generated,Just made me to want get stuck in faster,"None I don't think, it immediatly left my mind once I started thinking of words",Sometimes you might have an idea that can be improved (such as thinking of a word then using that to build a better one),Study was enjoyable. The message portion felt slightly irrelevant to me personally. For the word creation task being able to just click the letter and not have to drag it would be preferred.
p_726,30.0,Female,White or Caucasian,English,Bachelor’s degree,50.0,cognitive_inconsistency_2,cognitive_inconsistency,Cognitive Dissonance Theory,18.37,7,0.0,3,0.0,6,0.0,26,26,False,0,False,0,0.0,0,0.0,2.0,0.0,5.33,4.38,6.2,5.67,3.33,3.4,4.33,4.0,4.0,5.5,1.5,3.5,2.0,4.33,2.5,6.0,4.0,4.0,2.5,4.12,6.0,3.5,3.5,4.5,4.38,1.33,3.17,Something about trying and not trying,1.0,"Honestly, disinterested just wanted to do the task",It did not,I forgot the message almost instantly,I would need to know what relevance the message held,
p_727,30.0,Female,White or Caucasian,Bulgarian,Bachelor’s degree,50.0,self_concept_3,self_concept,Cognitive Dissonance Theory,19.46,5,0.0,3,0.0,7,0.0,12,12,False,0,False,0,0.0,1,1.06,0.0,0.0,6.0,5.0,5.6,3.0,3.67,4.4,4.33,5.0,3.5,4.5,3.0,4.0,3.0,4.5,3.17,3.5,3.5,3.5,4.0,3.62,3.5,4.0,3.0,3.0,3.38,2.0,3.83,"Something that is me and it's mine, something about strength",1.0,Thought the message was nice,,No not really,I'd keep it the same,"I thought it was great, wished it was a little bit longer as I just got into it when my timer ended."
p_728,36.0,Male,White or Caucasian,Polish,Bachelor’s degree,100.0,dissonance_reduction_2,dissonance_reduction,Cognitive Dissonance Theory,22.54,7,0.0,2,0.0,4,0.0,8,8,False,0,False,0,0.0,0,0.0,0.0,0.0,7.0,6.5,6.4,2.33,1.0,3.6,2.67,5.0,4.0,5.0,2.0,2.5,2.0,4.17,2.67,3.5,3.0,3.0,3.5,3.25,3.0,3.0,3.0,3.0,3.0,2.44,4.83,I don't remember exactly but it was irrelevant to the task.,1.0,I felt it were empty words,it did not,no,something about remembering that you should calm down because you can do it well,It was fun. The game could be longer.
p_729,28.0,Male,Asian / Pacific Islander,English,Master’s degree,8.0,dissonance_arousal_2,dissonance_arousal,Cognitive Dissonance Theory,16.33,8,0.0,2,0.0,3,0.0,8,8,False,0,False,0,0.0,0,0.0,0.0,0.0,6.0,5.38,6.8,6.0,4.0,6.0,6.33,6.5,4.5,4.5,6.0,4.5,3.5,5.17,4.67,5.5,5.5,5.0,6.0,5.5,5.5,5.5,6.5,5.5,5.75,2.44,3.83,No i am not fully remember the message,4.0,i feel emotional while read the message,it help to build the word,i can't remember at this moment,No,very interesting study
