p_1005,29.0,Female,Black or African American,english,Bachelor’s degree,2.0,relatedness_1,relatedness,Self-Determination Theory,18.47,6,0.0,3,0.0,8,0.0,20,20,False,0,False,0,0.0,0,0.0,0.0,0.0,7.0,6.25,7.0,3.33,2.0,2.4,4.0,7.0,4.0,6.5,2.0,5.5,1.5,6.33,2.5,6.0,4.0,6.0,6.0,5.5,5.5,5.5,6.0,6.0,5.75,1.11,5.5,the impact we have on others,4.0,nothing,it didnt,no,no,i loved it
p_1006,27.0,Male,White or Caucasian,English,Bachelor’s degree,0.0,performance_accomplishments_1,performance_accomplishments,Self-Efficacy Theory,34.57,6,0.0,0,0.0,3,0.0,10,10,False,0,False,0,0.0,1,35.66,0.0,0.0,5.67,5.25,6.4,6.0,4.33,5.6,6.33,4.5,3.0,6.0,1.5,5.0,1.0,5.17,1.83,5.5,3.5,5.5,5.0,4.88,4.0,3.0,3.0,3.0,3.25,1.44,4.33,"It asked me to remember a challenge I had performed well in previously, and to take that feeling and use it to help me with this task. It was very encouraging.lp",4.0,I felt encouraged and supported,It made me enter into the word challenge with a more positive 'can do' attitude.,"Yes, the positive encouragement","I would keep the message the same, it was very helpful","Quick and easy. But If it's possible, it would be easier to create words if you just had to click on the letters in order to make new words, rather than having to drag each letter into a separate box individually"
p_1007,31.0,Female,White or Caucasian,English,Bachelor’s degree,0.0,emotional_arousal_1,emotional_arousal,Self-Efficacy Theory,45.83,7,0.0,6,0.0,11,0.0,34,34,False,0,False,0,0.0,0,0.0,0.0,0.0,7.0,5.25,6.6,6.0,5.67,5.8,6.0,4.0,4.5,5.0,2.5,3.5,2.5,4.17,3.17,5.5,5.0,5.5,6.0,5.5,5.5,5.0,2.5,2.0,3.75,1.11,4.0,Whether you get stressed or excited when completing a challenge,3.0,Hope,Calmed down more,To not let stress affect me as much,Reading the words carefully/slowing down (I spelt a word wrong while rushing in the practice round),"It was fun, I'd like to do more"
p_1008,22.0,Male,White or Caucasian,English,"Some college credit, no degree",20.0,dissonance_reduction_3,dissonance_reduction,Cognitive Dissonance Theory,20.63,8,0.0,2,0.0,7,0.0,20,20,False,0,False,0,0.0,1,1.08,1.0,0.0,4.67,3.12,5.0,3.0,1.33,1.2,4.0,6.5,2.5,5.0,3.5,4.0,2.0,5.17,2.67,5.5,1.0,3.5,4.0,3.5,6.0,3.5,3.5,4.0,4.25,1.33,5.0,Something about bridging a gap and self belief.,1.0,,Not at all,No,Something more relevant to the task,"It was a bit broken as immediately after the first word puzzle it sent me to the completion code page with no code to paste in, but it was an interesting approach."
p_1009,35.0,Female,White or Caucasian,english,Trade/technical/vocational training,10.0,autonomy_1,autonomy,Self-Determination Theory,56.37,4,0.0,0,0.0,1,0.0,4,4,False,0,False,1,6.42,1,9.58,0.0,0.0,5.0,4.12,4.8,6.33,5.0,5.0,5.33,3.5,4.5,4.0,3.5,4.0,3.5,3.83,3.83,4.0,4.0,4.5,4.0,4.12,3.0,4.0,3.5,4.5,3.75,2.67,4.0,"it reflects personal choice, the amount of effort is upto us",2.0,i wanted to do well,i wanted to do as many words as possible,effort was reflects personal choice,good luck,i wanted to complete more words but the game caused my computer to go slow. But completing the questions my computer was fine. Sadly i scored really low when i could of got more if i didnt need to drag the letters
p_1010,25.0,Male,White or Caucasian,English,Master’s degree,50.0,vicarious_experience_2,vicarious_experience,Self-Efficacy Theory,13.99,6,1.0,4,1.0,4,1.0,0,32,False,0,True,1,35.96,1,38.91,0.0,4.0,6.0,5.88,7.0,6.0,3.67,6.0,7.0,7.0,1.5,7.0,1.0,5.0,1.5,6.33,1.33,7.0,7.0,7.0,7.0,7.0,7.0,6.0,3.0,3.0,4.75,1.0,5.17,the message was a motivational quote for me before i did the challenge.,2.0,I felt inspired and motivated to complete the task,I felt more confident in my abilities,I felt confident throughout because the message was inspiring,I would emphasise that everyone can do anything if they put their mind to it,Was a fantastic study - thanks for the opportunity and have a great weekend! :)
p_1011,25.0,Female,White or Caucasian,English,Bachelor’s degree,5.0,social_sanctions_2,social_sanctions,Social Norms Theory,23.28,5,1.0,1,1.0,8,1.0,0,26,False,0,True,1,61.75,1,7.07,3.0,0.0,7.0,6.25,4.4,5.33,3.33,3.6,4.33,5.5,4.0,5.0,1.5,3.5,2.5,4.67,2.67,5.0,5.0,5.5,5.5,5.25,4.5,5.0,3.0,3.0,3.88,1.89,2.33,Peers will judge how much effort you put in to the challenge,3.0,Intrigue,Almost no effect,None. I forgot once I started.,Please put in effort to the challenge.,
p_1012,24.0,Female,White or Caucasian,english,Bachelor’s degree,8.0,autonomy_3,autonomy,Self-Determination Theory,38.29,2,0.0,3,1.0,6,1.0,0,12,False,0,True,0,0.0,1,36.77,0.0,0.0,7.0,5.12,6.0,3.0,5.33,4.8,4.33,6.0,2.5,4.5,3.0,5.0,2.5,5.17,2.67,4.0,4.5,3.5,4.0,4.0,5.5,5.5,5.0,5.0,5.25,1.44,3.83,being able to take control and guide yourself through the challenge,3.0,slightly confused,I tried to remember that I was in control,being in control,to not panic and try and not look at the time too much,
p_1013,25.0,Female,Asian / Pacific Islander,"English, Urdu",Bachelor’s degree,10.0,performance_accomplishments_3,performance_accomplishments,Self-Efficacy Theory,20.64,7,0.0,3,1.0,7,1.0,0,28,False,0,True,1,39.17,0,0.0,0.0,1.0,7.0,6.0,6.4,6.0,4.67,6.0,6.0,5.5,3.5,6.0,2.5,5.5,4.0,5.67,3.33,6.0,6.0,6.0,6.0,6.0,6.0,5.5,6.0,6.0,5.88,2.89,6.0,The message talked about a situation where I felt a challenge and how did i manage it.,4.0,The memory of that challenge came in my mind.,The message did not affect the creation challenge in a broad way but did affect in managing the situation.,"Yes, by tackling the challenging situation.","This task is more than just finding words or solving puzzles—it's about building resilience, confidence, and mastery through effort. You don’t need to get everything right the first time.",
p_1014,,,,,,,autonomy_3,autonomy,Self-Determination Theory,26.57,7,0.0,1,0.0,1,0.0,2,2,False,0,False,0,0.0,1,31.36,0.0,0.0,,,,,,,,,,,,,,,,,,,,,,,,,,,,,,,,,,
p_1015,30.0,Female,White or Caucasian,English,Bachelor’s degree,4.0,dissonance_arousal_1,dissonance_arousal,Cognitive Dissonance Theory,19.78,3,1.0,4,1.0,8,1.0,0,52,False,0,True,1,41.82,0,0.0,6.0,2.0,5.67,5.38,6.4,6.33,4.0,6.6,6.0,5.5,2.5,6.5,1.5,3.5,3.0,5.17,2.33,5.5,5.0,5.0,3.0,4.62,6.0,3.5,1.0,1.0,2.88,1.67,5.83,I think it was about paying attention and doing the right thing,2.0,Commitment - I wanted to give the study my all,I don't feel that it had any impact on this,No,I'd make it similar to the one I read as I found it really effective,Thoroughly enjoyed it
p_1016,30.0,Female,White or Caucasian,English,"High school graduate, diploma or the equivalent (for example: GED)",100.0,competence_1,competence,Self-Determination Theory,19.96,4,0.0,4,0.0,5,0.0,10,10,False,0,False,0,0.0,0,0.0,0.0,0.0,4.33,5.62,5.4,3.67,2.0,3.6,4.0,4.0,5.5,3.0,4.0,4.0,3.5,3.67,4.33,3.5,4.0,4.0,3.5,3.75,4.5,5.0,4.5,4.0,4.5,2.67,4.33,Can't remember it much but something about when things click and you can do those things - sorry can't remember it much!,1.0,Nothing,No,"No, I don't really remember the message",You can do it!! Words of encouragement,"I thought the study was fun and I enjoyed the word numbers task, I think maybe the format could be better as I felt I was wasting time dragging the letters back down to the bottom when I didn't want to use them."
p_1017,,,,,,,control,control,No Theory,13.48,5,0.0,1,0.5,2,1.0,4,8,False,0,True,0,0.0,1,0.6,0.0,0.0,,,,,,,,,,,,,,,,,,,,,,,,,,,,,,,,,,
p_1018,27.0,Male,White or Caucasian,English,Bachelor’s degree,200.0,social_sanctions_3,social_sanctions,Social Norms Theory,19.0,6,0.0,4,0.0,6,0.0,20,20,False,0,False,0,0.0,0,0.0,1.0,0.0,7.0,5.12,5.6,5.33,5.0,4.4,4.67,5.0,3.5,4.5,3.5,4.0,4.0,4.5,3.67,4.5,3.0,4.0,4.5,4.0,5.5,4.5,4.5,6.0,5.12,2.0,4.33,being honest about your mistakes and moving forward after admitting them.,2.0,i thought it was trying to tell me about how I should conduct myself during the task.,"It made me be more honest with my word creation, as sometimes the game seemed to accept words that weren't words.",Being honest,I think it's a good life matra to be honest and forthcoming about our mistakes.,it was a fun task with a somehwat mysterious message
p_1019,28.0,Male,Black or African American,English,Bachelor’s degree,3.0,emotional_arousal_3,emotional_arousal,Self-Efficacy Theory,26.39,4,0.0,3,0.0,3,0.0,4,4,False,0,False,0,0.0,0,0.0,0.0,0.0,7.0,5.88,7.0,5.67,6.33,6.4,7.0,1.5,3.0,4.5,4.0,2.5,1.0,2.83,2.67,5.0,2.5,3.0,4.5,3.75,5.0,4.5,3.5,3.0,4.0,1.22,2.17,the feeling of being in the zone helping me to stay true to myself and what I am working towards.,5.0,I felt motivated and inspired.,I think it shifted my focus on what was going on in the game.,"That I must be absorbed in what I am working towards, and in this case, it was doing my best to get as many words as I could.",I would allow them to type a word rather than drag out like in this. It is faster this way.,I loved it. Although I wish it was possible to type the words and not drag them.
p_1020,30.0,Female,White or Caucasian,English,Master’s degree,50.0,relatedness_3,relatedness,Self-Determination Theory,12.93,4,0.0,3,0.0,8,0.0,24,24,False,0,False,0,0.0,0,0.0,1.0,0.0,7.0,5.25,6.8,4.0,3.0,5.8,6.0,5.5,3.0,5.5,3.0,5.5,3.0,5.5,3.0,6.0,5.5,6.0,5.5,5.75,5.5,6.0,5.5,6.0,5.75,2.0,5.0,I can't remember at all,1.0,I was very neutral - I can't remember at all,It didn't,"No, I can't remember the message at all",I would make it more memorable,
p_1021,30.0,Male,White or Caucasian,English,Master’s degree,30.0,self_concept_2,self_concept,Cognitive Dissonance Theory,31.11,4,0.0,2,0.22,9,1.0,20,32,False,0,True,0,0.0,1,4.8,0.0,1.0,6.67,6.38,7.0,4.33,3.0,1.4,4.33,4.5,3.0,6.5,1.0,4.0,1.5,5.0,1.83,5.0,4.0,6.0,6.5,5.38,5.0,7.0,5.0,6.0,5.75,1.0,2.83,Relaxing and being confident in my ability to create words from the letters,1.0,"Confidence, relaxed",No,No,"Take your time, try to relax",
p_1022,22.0,Male,White or Caucasian,english,"High school graduate, diploma or the equivalent (for example: GED)",0.0,vicarious_experience_1,vicarious_experience,Self-Efficacy Theory,11.66,5,0.0,4,0.0,3,0.0,12,12,False,0,False,0,0.0,0,0.0,0.0,0.0,7.0,5.75,4.8,6.0,2.0,3.8,6.0,5.0,3.5,4.5,5.0,4.5,3.5,4.67,4.0,4.0,4.0,4.0,4.0,4.0,3.5,4.0,4.0,4.0,3.88,2.89,4.5,a similar experience ive had previously or witnessed,3.0,None really,It didn't,,I'd have no message,
p_1024,36.0,Female,White or Caucasian,English,Bachelor’s degree,30.0,verbal_persuasion_3,verbal_persuasion,Self-Efficacy Theory,13.98,4,0.0,3,0.0,6,0.0,10,10,False,0,False,0,0.0,1,24.63,1.0,0.0,5.67,4.75,5.8,5.67,4.33,5.0,6.33,5.5,3.0,5.0,3.0,4.0,3.5,4.83,3.17,5.0,5.0,5.5,5.0,5.12,4.0,5.5,4.0,3.5,4.25,1.11,4.83,encouragement and how it made me feel and how it impacted on my performance,4.0,"positivity, encouragement",i was more open and confident,not sure as I was focused on the challenge,reinforce confidence,"I enjoyed it but the means of entering words was a bit clumsy, would have preferred to use the keyboard"
p_1025,30.0,Female,White or Caucasian,english,Bachelor’s degree,15.0,emotional_arousal_2,emotional_arousal,Self-Efficacy Theory,15.36,6,0.0,4,0.0,5,0.0,14,14,False,0,False,0,0.0,0,0.0,0.0,0.0,7.0,6.25,6.0,4.0,2.67,3.2,3.0,7.0,3.5,6.0,4.0,5.0,4.0,6.0,3.83,6.0,4.5,3.5,3.5,4.38,5.5,4.0,4.0,4.0,4.38,1.0,4.83,"the game was more about just creating words, there was a deeper meaning to it",2.0,curiosity,no it didnt influence me,not really - i struggled to remember what the message said,"i wouldnt include it, it was slightly distracting to the task","i enjoyed doing the task - especially as i'm doing it early in the morning, it feels like its woken my brain up for the day!"
p_1026,30.0,Male,White or Caucasian,English,"Some college credit, no degree",100.0,competence_2,competence,Self-Determination Theory,14.44,4,0.0,2,0.0,4,0.0,8,8,False,0,False,0,0.0,1,0.98,1.0,0.0,7.0,5.62,5.2,6.0,6.33,6.0,6.33,6.5,3.0,5.0,5.0,4.5,2.5,5.33,3.5,5.0,5.5,5.5,5.5,5.38,6.0,4.5,5.5,4.0,5.0,2.11,5.17,Challenging yourself to grow,5.0,Motivation,It made me want to try,That it being hard meant that it was making me better,"It might not make sense at first, but keep trying.",
p_1027,27.0,Male,White or Caucasian,english,"High school graduate, diploma or the equivalent (for example: GED)",0.0,reference_group_identification_2,reference_group_identification,Social Norms Theory,13.22,4,0.0,4,1.0,8,1.0,0,26,False,0,True,0,0.0,1,26.95,2.0,0.0,6.33,4.38,6.0,1.33,2.0,3.6,4.33,5.0,3.5,5.0,4.5,4.0,2.5,4.67,3.5,5.0,5.0,5.0,6.0,5.25,4.5,4.0,2.5,5.0,4.0,1.44,5.33,Try to rember my self and what group im part of,1.0,No emotions just felt like i eas reading,none,no,Have a bigger deal about thier daily emotions that they feel,I liked this challenge alot. Would be nice if I could of typed the letters instead of drgging them
p_1028,33.0,Male,White or Caucasian,English,"Some college credit, no degree",3.0,verbal_persuasion_2,verbal_persuasion,Self-Efficacy Theory,16.3,8,0.0,4,0.0,4,0.0,10,10,False,0,False,0,0.0,1,10.98,0.0,0.0,6.33,5.75,6.2,5.67,4.33,6.0,5.67,4.5,4.0,5.0,3.0,4.5,3.0,4.67,3.33,5.5,5.5,5.0,4.0,5.0,5.0,4.0,4.0,4.5,4.38,2.11,4.5,saying they believed that i could do the challenge,4.0,made me feel positive about the task at hand,made me feel more confident,not really i was focused on finding words,i would emphasize the belief in the person,"it was a fun exercise, would happily have gone through many more rounds"
p_1029,32.0,Female,Black or African American,English,Master’s degree,20.0,competence_3,competence,Self-Determination Theory,18.26,9,0.0,0,1.0,5,1.0,0,18,False,0,True,1,0.58,1,28.37,1.0,0.0,6.0,6.12,7.0,6.67,1.67,3.4,5.0,4.0,2.5,5.0,2.0,5.0,2.0,4.67,2.17,7.0,3.0,6.0,6.0,5.5,5.5,4.0,4.5,5.5,4.88,1.11,3.83,practicing a task and getting better at it,4.0,positive thoughts,Not at all,Keep going,Nothing. its okay as it is,I loved the game. it was entertaining
p_1030,33.0,Male,White or Caucasian,English,"Some high school, no diploma",0.0,relatedness_2,relatedness,Self-Determination Theory,12.41,6,0.0,4,0.0,5,0.0,18,18,False,0,False,0,0.0,1,6.67,1.0,0.0,6.0,3.38,4.2,2.0,2.0,2.2,2.33,4.5,3.0,4.5,4.0,3.0,4.0,4.0,3.67,4.5,4.5,4.0,4.0,4.25,4.5,3.5,2.5,2.5,3.25,2.67,4.33,Unsure,1.0,Nothing,I dont feel like it did,"No, i didnt think it was related",Reminding them to stay calm and think logically,
p_1031,30.0,Female,White or Caucasian,English,Bachelor’s degree,0.0,reference_group_identification_1,reference_group_identification,Social Norms Theory,15.04,4,0.0,5,0.71,7,1.0,6,26,False,0,True,0,0.0,1,7.25,0.0,1.0,7.0,5.38,5.8,2.0,1.0,2.2,2.0,6.0,2.0,4.5,3.0,3.0,4.5,4.5,3.17,3.0,2.0,2.0,2.0,2.25,3.0,2.5,2.0,2.0,2.38,1.56,3.83,being part of a community,2.0,confusion,"no, it had no influence",no,not sure,I enjoyed it and the instructions were clear
p_1032,31.0,Female,White or Caucasian,English,Bachelor’s degree,5.0,descriptive_norms_1,descriptive_norms,Social Norms Theory,21.83,5,0.0,3,1.0,1,1.0,0,0,False,0,True,0,0.0,1,0.3,0.0,0.0,7.0,6.88,6.8,3.33,4.33,4.4,3.0,5.5,6.0,5.5,5.0,5.5,4.0,5.5,5.0,5.5,6.0,6.0,5.5,5.75,6.0,6.5,5.0,7.0,6.12,3.11,2.67,Paying attention to the study.,1.0,Confusion,Not so much,No,I would emphasize the importance of paying attention to the study and keeping any outside distractions at bay.,I thought this was a very thought provoking study. The questions afterwards made me realise that the statement at the beginning was almost more important than the actual study itself. Also the final word creation task was very difficult!
p_1033,24.0,Female,White or Caucasian,English,"Some high school, no diploma",2.0,vicarious_experience_1,vicarious_experience,Self-Efficacy Theory,16.87,1,0.0,2,0.0,5,0.0,10,10,False,0,False,0,0.0,0,0.0,0.0,0.0,7.0,5.88,6.2,6.67,5.33,6.2,6.67,5.0,3.5,1.5,6.5,3.0,1.0,3.17,3.67,3.0,5.0,4.5,4.0,4.12,6.0,6.0,3.5,1.5,4.25,2.0,4.5,How I would feel after witnessing someone complete a challenge and learning about their tactics and taking on board how thy done it,2.0,"Felt interested, maybe not capable some nerves too before starting if I were able to do it",Thinking of a stratgey to help me,Thinking about making the decision or get myself in the mind frame,key angles of though process to assist you of thinking of words,
p_1034,33.0,Male,White or Caucasian,English,Doctorate degree,100.0,competence_2,competence,Self-Determination Theory,15.86,2,0.33,3,0.33,6,1.0,16,26,False,0,True,0,0.0,1,7.49,2.0,0.0,6.0,5.75,5.0,4.67,2.0,3.0,4.0,4.0,4.0,3.5,5.0,3.5,3.0,3.67,4.0,3.0,3.0,3.0,3.0,3.0,3.0,3.0,3.0,3.0,3.0,2.44,4.0,something about working hard or trying hard to achieve something.,1.0,I thought it was a bit odd,Not at all,Nothing,I'd just say relax and have fun,
p_1035,32.0,Male,White or Caucasian,English,Professional degree,100.0,social_sanctions_3,social_sanctions,Social Norms Theory,12.25,7,0.0,6,0.0,9,0.0,30,30,False,0,False,0,0.0,0,0.0,1.0,0.0,7.0,6.0,6.2,3.33,2.0,2.0,4.33,6.5,2.5,6.0,2.5,3.5,3.0,5.33,2.67,6.0,3.5,3.5,3.5,4.12,6.0,5.5,4.0,5.0,5.12,1.33,6.0,Recieving help from others,4.0,Indifference,It didn't,no,tips on word creation,
p_1036,31.0,Male,White or Caucasian,Lithuanian,"High school graduate, diploma or the equivalent (for example: GED)",0.0,self_concept_1,self_concept,Cognitive Dissonance Theory,21.04,1,0.0,2,0.0,6,0.0,30,30,False,0,False,0,0.0,1,3.44,1.0,1.0,6.67,3.62,7.0,3.0,1.0,1.0,4.0,4.0,2.5,2.5,3.0,2.5,1.0,3.0,2.17,1.0,1.0,1.0,1.0,1.0,1.0,4.0,1.0,1.0,1.75,1.0,3.17,Cannot remember specifics because it sounded tacky as I purposely did not try to memorize it. It was a general motivation message to try hard.,2.0,No emotions.,It did not influence me in any way.,Nothing stayed.,No tacky motivational message will help to be better at solving puzzles.,It was interesting.
p_1037,21.0,Male,White or Caucasian,English,Trade/technical/vocational training,10.0,emotional_arousal_3,emotional_arousal,Self-Efficacy Theory,22.23,6,1.0,3,1.0,7,1.0,0,26,False,0,True,1,36.56,0,0.0,1.0,0.0,6.33,5.0,5.6,3.67,1.67,2.4,3.33,5.0,2.5,5.0,2.5,4.5,2.5,4.83,2.5,4.5,5.0,4.5,5.5,4.88,3.5,5.0,4.0,4.0,4.12,3.89,4.67,how people like taking part in a challenge,1.0,curiosity,no difference,no,one that was more relevant to the task,To see if people remembered the message after being absorbed in the anagram task
p_1038,29.0,Male,White or Caucasian,English,Bachelor’s degree,100.0,relatedness_3,relatedness,Self-Determination Theory,23.81,4,0.0,3,1.0,7,1.0,0,46,False,0,True,1,24.25,0,0.0,3.0,3.0,7.0,6.62,6.6,4.33,2.33,2.6,4.67,6.5,4.0,6.0,3.5,3.5,2.0,5.33,3.17,2.5,2.5,2.5,3.0,2.62,6.5,7.0,4.5,6.0,6.0,1.78,2.67,opening up to sharing ideas to your family or people you're comfortable with.,4.0,I thought it was an attention check so I didn't really understand it.,It didn't. I play along with a TV show called Countdown a lot so I jumped in.,No.,I would include long words to help their brain boot up and make more advanced results.,I enjoyed it. I do wonder if there were more challenges to be completed. I did one and then I was led here. Not sure if a mistake was made.
p_1039,,,,,,,social_sanctions_2,social_sanctions,Social Norms Theory,11.79,6,0.0,0,0.0,0,0.0,0,0,False,0,False,0,0.0,0,0.0,0.0,0.0,,,,,,,,,,,,,,,,,,,,,,,,,,,,,,,,,,
p_1040,28.0,Female,White or Caucasian,English,Bachelor’s degree,127.0,autonomy_2,autonomy,Self-Determination Theory,18.66,4,0.0,6,1.0,6,1.0,0,18,False,0,True,0,0.0,1,13.96,1.0,0.0,6.0,3.75,4.2,1.67,1.0,1.0,2.33,2.5,3.5,4.5,3.0,2.5,3.5,3.17,3.33,1.5,1.0,1.0,1.0,1.12,2.5,2.5,1.0,3.0,2.25,1.44,4.0,creating something of your own,1.0,,,No,I have no idea,
p_1041,34.0,Non-binary,White or Caucasian,"italian, english","Some college credit, no degree",100.0,verbal_persuasion_2,verbal_persuasion,Self-Efficacy Theory,211.09,5,0.0,4,0.0,5,0.0,10,10,False,0,False,0,0.0,1,1.14,0.0,0.0,5.67,3.5,3.0,4.0,2.67,2.4,4.0,4.5,5.5,3.0,4.0,2.5,5.0,3.33,4.83,3.5,2.5,3.0,3.0,3.0,3.0,2.5,2.0,2.0,2.38,2.89,5.0,me being able to solve the challenge,4.0,I thought it was useless because I was hoping for strategies to solve the problem rather than simple encouragement,it didn't,no,I would provide suggestions to solve the problem,
p_1042,20.0,Prefer not to answer,White or Caucasian,English,"High school graduate, diploma or the equivalent (for example: GED)",20.0,descriptive_norms_2,descriptive_norms,Social Norms Theory,13.17,5,0.0,0,0.0,6,0.0,16,16,False,0,False,0,0.0,1,55.11,1.0,0.0,4.67,4.25,4.6,4.0,4.0,4.0,4.0,4.0,4.0,4.0,4.0,4.0,4.0,4.0,4.0,5.0,4.0,4.0,4.5,4.38,4.0,4.5,4.5,4.5,4.38,3.67,4.0,creating words,1.0,curious,no,no,"don't know, sorry",
p_1043,26.0,Male,Black or African American,English,Bachelor’s degree,10.0,dissonance_arousal_3,dissonance_arousal,Cognitive Dissonance Theory,18.39,7,0.0,0,0.0,5,0.0,18,18,False,0,False,0,0.0,0,0.0,0.0,1.0,6.0,6.25,6.2,4.0,4.0,4.0,6.0,6.0,4.0,5.5,1.5,6.0,4.5,5.83,3.33,5.5,5.5,6.0,6.0,5.75,5.0,6.0,3.0,2.5,4.12,2.0,3.17,I honestly can't remember,1.0,,,,,how we approach certain challenges
p_1044,26.0,Male,White or Caucasian,english,Associate degree,100.0,dissonance_reduction_3,dissonance_reduction,Cognitive Dissonance Theory,13.5,7,0.0,1,0.0,3,0.0,10,10,False,0,False,0,0.0,0,0.0,0.0,0.0,6.0,4.62,5.2,1.0,1.0,1.6,2.33,6.0,3.5,3.5,4.0,2.5,2.0,4.0,3.17,5.0,3.0,4.0,3.5,3.88,4.0,3.0,3.0,2.0,3.0,2.33,4.17,Can't remember,1.0,Confusion,None at all,,Unsure,
p_1045,25.0,Female,White or Caucasian,english,Bachelor’s degree,300.0,verbal_persuasion_1,verbal_persuasion,Self-Efficacy Theory,12.78,6,0.0,4,0.0,9,0.0,36,36,False,0,False,0,0.0,0,0.0,1.0,1.0,5.67,5.38,5.4,6.0,2.67,3.8,4.67,6.0,2.5,5.5,1.5,2.5,3.5,4.67,2.5,5.0,2.5,5.0,3.5,4.0,4.5,3.5,1.0,1.0,2.5,1.33,4.67,my capability to complete the task,5.0,"courage, confidence",it didnt,no,emphasize the belief in the participants ability to succeed in the task,it was very easy to understand and all worked as expected
p_1048,29.0,Female,White or Caucasian,English,Bachelor’s degree,100.0,control,control,No Theory,32.46,7,0.0,3,0.0,6,0.0,26,26,False,0,False,0,0.0,1,9.98,0.0,1.0,6.0,5.5,5.8,4.67,3.0,4.8,3.33,4.5,3.5,5.0,2.0,3.5,3.0,4.33,2.83,5.5,3.0,5.0,4.0,4.38,5.5,4.0,2.5,3.0,3.75,1.56,5.17,Not sure,1.0,None really,No,No,Good luck etc,Fun
p_1049,30.0,Female,Black or African American,ENGLISH,Bachelor’s degree,5.0,control,control,No Theory,16.01,6,0.0,1,0.0,5,0.0,8,8,False,0,False,0,0.0,0,0.0,0.0,0.0,6.0,4.62,7.0,6.0,5.33,6.2,5.67,6.0,3.0,6.0,4.0,6.0,3.0,6.0,3.33,6.0,6.0,6.0,6.0,6.0,6.0,6.0,6.0,5.0,5.75,1.11,5.33,SOMEWHAT,4.0,FOCUS,IT MADE ME MORE FOCUSED,YES WHICH IS CREATING LONGER WORDS,PUTTING ON YOUR CREATIVE CAP,I LOVE IT
p_1050,32.0,Male,Black or African American,English,Master’s degree,100.0,social_sanctions_1,social_sanctions,Social Norms Theory,20.52,7,0.0,1,0.0,6,0.0,18,18,False,0,False,1,8.36,0,0.0,1.0,0.0,7.0,6.0,7.0,7.0,6.67,7.0,6.33,5.5,3.5,6.5,1.5,6.0,1.5,6.0,2.17,6.5,5.5,6.5,6.5,6.25,6.0,5.5,6.0,4.5,5.5,1.33,1.83,instructions to complete the challenge,4.0,i was excited about the challenge,the message made me approcah the challenge carefully,the instructions helped me stay on track,i would allow creators type the words out directly,i found the study really engaging and interersting . It ignites the creativity in a person. I'd recommend this and would definitely love to take more of it. I enjoyed it
p_1051,33.0,Male,White or Caucasian,English,Bachelor’s degree,70.0,performance_accomplishments_3,performance_accomplishments,Self-Efficacy Theory,27.46,3,0.0,2,0.2,5,1.0,12,14,False,0,True,0,0.0,1,0.23,0.0,0.0,6.33,6.38,6.4,6.0,4.0,6.6,4.67,5.0,3.5,5.5,4.0,5.0,3.5,5.17,3.67,5.0,6.5,6.0,5.5,5.75,6.0,6.5,5.0,5.5,5.75,1.56,4.0,asking if I could remember a situation where I tackled a new challenge successfully and if I experienced a sense of mastory,5.0,determination,I don't think it did maybe a bit more determined,not really,Just motivate them to do their best.,"It was a fun study, it was hard thinking of the words! I had no tech issues and everything worked well :)"
p_1052,30.0,Female,White or Caucasian,English,Bachelor’s degree,50.0,emotional_arousal_2,emotional_arousal,Self-Efficacy Theory,39.29,1,0.0,6,0.0,7,0.0,20,20,False,0,False,0,0.0,0,0.0,0.0,0.0,6.0,5.75,6.8,4.0,5.0,4.6,3.0,6.0,3.0,1.5,5.5,4.0,4.5,3.83,4.33,2.0,2.0,2.0,4.0,2.5,3.0,6.0,2.5,3.0,3.62,1.78,2.83,being alert and focusing.,1.0,I felt determined,It made me want to do well,to consentrate,To make people feel positive,"I enjoyed it, although the time element made me panic slightly."
p_1053,22.0,Female,White or Caucasian,English,Bachelor’s degree,5.0,control,control,No Theory,17.24,4,0.0,4,0.43,7,1.0,16,22,False,0,True,0,0.0,1,2.21,0.0,1.0,6.33,4.25,5.6,6.0,5.0,4.6,5.33,5.5,4.0,2.5,5.5,3.5,3.5,3.83,4.33,3.5,4.0,6.0,4.0,4.38,5.5,4.5,5.0,5.0,5.0,2.11,3.5,Continue with the survey when the continue button pops up,2.0,impaitence,,,More relevant content,
p_1054,27.0,Female,White or Caucasian,English,Master’s degree,3.0,descriptive_norms_3,descriptive_norms,Social Norms Theory,14.98,3,0.0,3,0.0,6,0.0,20,20,False,0,False,0,0.0,0,0.0,1.0,0.0,7.0,5.5,7.0,5.0,4.33,5.2,5.0,6.5,3.0,5.5,3.0,4.5,3.0,5.5,3.0,5.0,6.0,5.5,4.5,5.25,5.0,5.5,5.5,6.0,5.5,1.22,4.5,some people like to take a step back and take a breath when faced with a task,2.0,"I felt agreement when I read the message, slight frustration with myself as that is not always my approach",I tried to take a breath when I got stressed during the challenge,To take a breather when stressed,I would emphasize to try to be calm under pressure,"The study was great, very easy to understand."
p_1055,21.0,Female,White or Caucasian,English,"High school graduate, diploma or the equivalent (for example: GED)",10.0,performance_accomplishments_3,performance_accomplishments,Self-Efficacy Theory,15.99,4,0.67,3,0.0,7,0.0,22,22,False,0,False,0,0.0,1,0.27,0.0,0.0,7.0,5.75,6.0,5.67,3.67,3.6,6.0,5.0,2.0,5.0,2.5,4.5,2.5,4.83,2.33,4.0,4.5,5.0,4.5,4.5,5.0,4.5,3.0,3.0,3.88,2.11,4.5,mastering and overcoming a challenge and feeling accomplished and proud.,3.0,Thoughts about previous challenges that I have faced,Did not influence how I approached the challenge,,To use both efficiency and the need to succeed to do well in the task,
